Name,Link,Ingredients_x,Main Spirit,Flavor,Rating,Ratings Count,Ingredients_y,Color,Occasion,Description,orange,cranberry,pineapple,citrus,bitters,fresh,herb,cinnamon,Cinnamon,Mint,Lime
DeKuyper Banana Split,https://www.thecocktailproject.com/drink-recipes/dekuyper-banana-split,"DeKuyper Creme de Banana Liqueur, DeKuyper Pucker Cherry Schnapps, DeKuyper Creme de Banana Liqueur, DeKuyper Pucker Cherry Schnapps, Whipped Cream, Cherries",Cordials,Fruity,2,30,"DeKuyper Creme de Banana Liqueur, DeKuyper Pucker Cherry Schnapps, Whipped Cream, Cherries",['red'],['birthday'],,NA,NA,NA,NA,NA,NA,NA,NA,nocinnamon,nomint,nolime
Boozy Pumpkin Milkshake,https://www.thecocktailproject.com/drink-recipes/boozy-pumpkin-milkshake,"DeKuyper Amaretto Liqueur, Jim Beam Original, DeKuyper Amaretto Liqueur, Jim Beam Original, Pumpkin Puree, Ice Cream, Vanilla Extract",Bourbon,Frozen,3,32,"DeKuyper Amaretto Liqueur, Jim Beam Original, Pumpkin Puree, Ice Cream, Vanilla Extract",,"['fall', 'halloween', 'holiday', 'thanksgiving']",,NA,NA,NA,NA,NA,NA,NA,NA,nocinnamon,nomint,nolime
Classic Manhattan,https://www.thecocktailproject.com/drink-recipes/classic-manhattan,"Jim Beam Original, JDK & Sons???????????????? O3 Premium Orange Liqueur, Jim Beam Original, JDK & Sons???????????????? O3 Premium Orange Liqueur, DeKuyper Pucker Cherry Schnapps, Bitters",Bourbon,Sweet,3,49,"Jim Beam Original, JDK & Sons???????????????????????? O3 Premium Orange Liqueur, DeKuyper Pucker Cherry Schnapps, Bitters",['brown'],"['birthday', 'fall']","How can you improve on perfection? With this classic Manhattan recipe! Boasting smooth Jim Beam?? Bourbon Whiskey, a dash of bitters, plus orange and cherry hues, this classic Manhattan cocktail is sweet, satisfying and seductively tasty. Great for relaxing after work, serving at poker parties or mixing up at your next gathering.",NA,NA,NA,NA,NA,NA,NA,NA,nocinnamon,nomint,nolime
Peach Sangria,https://www.thecocktailproject.com/drink-recipes/peach-sangria,"DeKuyper Peachtree Schnapps Liqueur, White Wine, DeKuyper Peachtree Schnapps Liqueur, White Wine, Oranges, Limes, Peaches, Soda Water",Cordials,Fruity,3,39,"DeKuyper Peachtree Schnapps Liqueur, White Wine, Oranges, Limes, Peaches, Soda Water",['clear'],['spring'],"For a hit during warm-weather months, try this white sangria recipe. The flavor of juicy, tree-ripened peaches from DeKuyper?? Peachtree?? Schnapps Liqueur jazzes up a basic white wine. Serve it alongside dinner for a refreshing treat.",NA,NA,NA,citrus,NA,NA,NA,NA,nocinnamon,nomint,lime
Mintini Martini,https://www.thecocktailproject.com/drink-recipes/mintini-martini,"DeKuyper Creme de Menthe Green Liqueur, DeKuyper Creme de Cocoa White Liqueur, DeKuyper Creme de Menthe Green Liqueur, DeKuyper Creme de Cocoa White Liqueur, Kamora Coffee Liqueur, Half and Half",Cordials,Sweet,3,42,"DeKuyper Creme de Menthe Green Liqueur, DeKuyper Creme de Cocoa White Liqueur, Kamora Coffee Liqueur, Half and Half",['green'],"['birthday', 'christmas', 'holiday', 'winter']",,NA,NA,NA,NA,NA,NA,NA,NA,nocinnamon,nomint,nolime
Holly Jolly Punch,https://www.thecocktailproject.com/drink-recipes/holly-jolly-punch,"DeKuyper Triple Sec Liqueur, Pinnacle Original Vodka, DeKuyper Triple Sec Liqueur, Pinnacle Original Vodka, Cranberry Juice, Ginger Ale, Frozen orange juice concentrate, Cinnamon Allspice, Nutmeg, Cranberries",Cordials,Sweet,3,74,"DeKuyper Triple Sec Liqueur, Pinnacle Original Vodka, Cranberry Juice, Ginger Ale, Frozen orange juice concentrate, Cinnamon Allspice, Nutmeg, Cranberries",['red'],"['bbq', 'christmas', 'fall', 'holiday', 'thanksgiving']","Gather round friends and family, treat them all to the Holly Jolly Punch. Part DeKuyper?? Triple Sec, part Pinnacle?? Original Vodka, this festive blend of flavors is bound to bring everyone closer these holidays. Carefully combine the ingredients in a punch bowl as you end the year with your nearest and dearest.",orange,cranberry,NA,NA,NA,NA,NA,cinnamon,cinnamon,nomint,nolime
Key Lime Pie Martini,https://www.thecocktailproject.com/drink-recipes/key-lime-pie-martini,"DeKuyper Vanilla Schnapps Liqueur, Pinnacle Citrus Vodka, DeKuyper Vanilla Schnapps Liqueur, Pinnacle Citrus Vodka, Lime Juice, Cream, Whipped Cream, Lime Wheel",Vodka,Sweet,3,28,"DeKuyper Vanilla Schnapps Liqueur, Pinnacle Citrus Vodka, Lime Juice, Cream, Whipped Cream, Lime Wheel",,"['birthday', 'ladies-night', 'summer', 'summer', 'summer', 'tropical']",Transport yourself to the Florida Keys with a new take on the classic martini. The DeKuyper?? Key Lime Pie Martini is like a dessert in a glass - boasting DeKuyper?? Vanilla Liqueur and Pinnacle?? Citrus Vodka combined with fresh lime juice and cream. Add a graham cracker rim and this key lime cocktail becomes a decadent after dinner treat or a summer party drink.,NA,NA,NA,citrus,NA,NA,NA,NA,nocinnamon,nomint,lime
Melon Creek Martini,https://www.thecocktailproject.com/drink-recipes/melon-creek-martini,"DeKuyper Pucker Watermelon Schnapps, Knob Creek Kentucky Straight Bourbon Whiskey, DeKuyper Pucker Watermelon Schnapps, Knob Creek Kentucky Straight Bourbon Whiskey, Cranberry Juice",Cordials,Sweet,3,26,"DeKuyper Pucker Watermelon Schnapps, Knob Creek Kentucky Straight Bourbon Whiskey, Cranberry Juice",['red'],"['bbq', 'ladies-night', 'summer', 'summer', 'summer']","Break the rules with a bourbon martini instead of traditional gin or vodka. Crisp and refreshing, this melon martini is a flavorful twist on a classic and works well for happy hour or post dinner drinks.",NA,cranberry,NA,NA,NA,NA,NA,NA,nocinnamon,nomint,nolime
Pumpkin Pie Martini,https://www.thecocktailproject.com/drink-recipes/pumpkin-pie-martini,"DeKuyper Buttershots Schnapps, Pinnacle Whipped Vodka, DeKuyper Buttershots Schnapps, Pinnacle Whipped Vodka, Cruzan 9 Spiced Rum, Half and Half, Pumpkin Puree, Pumpkin Spice, Whipped Cream, Variations of the Classic Martini",Rum,Sweet,3,39,"DeKuyper Buttershots Schnapps, Pinnacle Whipped Vodka, Cruzan 9 Spiced Rum, Half and Half, Pumpkin Puree, Pumpkin Spice, Whipped Cream, Variations of the Classic Martini",['brown'],"['fall', 'halloween', 'holiday', 'thanksgiving']","Turn any holiday gathering into something special with this decadent Pumpkin Pie Martini recipe. The rich, creamy taste of pumpkin and butterscotch combine with Pinnacle?? Whipped?? Vodka and smooth Cruzan?? Spiced Rum for a pumpkin pie cocktail that just may be their favorite new dessert. No forks required.",NA,NA,NA,NA,NA,NA,NA,NA,nocinnamon,nomint,nolime
Razzmatazz Truffle Martini,https://www.thecocktailproject.com/drink-recipes/razzmatazz-truffle-martini,"Pinnacle Whipped Vodka, DeKuyper Razzmatazz Schnapps Liqueur, Pinnacle Whipped Vodka, DeKuyper Razzmatazz Schnapps Liqueur, DeKuyper Creme De Cacao Dark Liqueur, Kamora Coffee Liqueur, Half and Half",Cordials,Sweet,3,35,"Pinnacle Whipped Vodka, DeKuyper Razzmatazz Schnapps Liqueur, DeKuyper Creme De Cacao Dark Liqueur, Kamora Coffee Liqueur, Half and Half",['brown'],"['birthday', 'ladies-night', 'spring']",,NA,NA,NA,NA,NA,NA,NA,NA,nocinnamon,nomint,nolime
Red Velvet Cake Martini,https://www.thecocktailproject.com/drink-recipes/red-velvet-cake-martini,"DeKuyper Hazelnut Schnapps Liqueur, DeKuyper Creme de Cocoa White Liqueur, DeKuyper Hazelnut Schnapps Liqueur, DeKuyper Creme de Cocoa White Liqueur, DeKuyper Michigan Cherry Schnapps Liqueur, Pinnacle Original Vodka, Grenadine, Sugar, Granulated, Cocoa Powder",Cordials,Sweet,3,33,"DeKuyper Hazelnut Schnapps Liqueur, DeKuyper Creme de Cocoa White Liqueur, DeKuyper Michigan Cherry Schnapps Liqueur, Pinnacle Original Vodka, Grenadine, Sugar, Granulated, Cocoa Powder",['brown'],"['birthday', 'ladies-night', 'holiday', 'valentines-day']",,NA,NA,NA,NA,NA,NA,NA,NA,nocinnamon,nomint,nolime
Sour Apple Popsicle Martini,https://www.thecocktailproject.com/drink-recipes/sour-apple-popsicle-martini,"DeKuyper Pucker Sour Apple Schnapps, Cream, DeKuyper Pucker Sour Apple Schnapps, Cream, Ice, Crushed",Cordials,Sour,3,41,"DeKuyper Pucker Sour Apple Schnapps, Cream, Ice, Crushed",['green'],"['birthday', 'ladies-night', 'summer']",,NA,NA,NA,NA,NA,NA,NA,NA,nocinnamon,nomint,nolime
Toffee Drop Martini,https://www.thecocktailproject.com/drink-recipes/toffee-drop-martini,"Jim Beam Original, DeKuyper Buttershots Schnapps, Jim Beam Original, DeKuyper Buttershots Schnapps, DeKuyper Creme de Cocoa White Liqueur, Half and Half",Bourbon,Sweet,3,37,"Jim Beam Original, DeKuyper Buttershots Schnapps, DeKuyper Creme de Cocoa White Liqueur, Half and Half",,"['birthday', 'halloween', 'holiday', 'winter']",,NA,NA,NA,NA,NA,NA,NA,NA,nocinnamon,nomint,nolime
White Chocolate Raspberry Martini,https://www.thecocktailproject.com/drink-recipes/white-chocolate-raspberry-martini,"DeKuyper Creme de Cocoa White Liqueur, Pinnacle Raspberry Vodka, DeKuyper Creme de Cocoa White Liqueur, Pinnacle Raspberry Vodka, Chocolate Sauce, Raspberries",Cordials,Sweet,3,37,"DeKuyper Creme de Cocoa White Liqueur, Pinnacle Raspberry Vodka, Chocolate Sauce, Raspberries",['clear'],"['birthday', 'ladies-night', 'holiday', 'valentines-day', 'winter']","Delight in the juicy tang of fresh raspberries drizzled in a luscious chocolate sauce with this white chocolate martini. The tartness of raspberry vodka cuts through the intense sweetness of the liqueur to create a balanced confection, perfect for dessert",NA,NA,NA,NA,NA,NA,NA,NA,nocinnamon,nomint,nolime
Razzmatazz Sangria,https://www.thecocktailproject.com/drink-recipes/razzmatazz-sangria,"DeKuyper Razzmatazz Schnapps Liqueur, Red Wine, DeKuyper Razzmatazz Schnapps Liqueur, Red Wine, Mixed Berries, Soda Water",Cordials,Fruity,3,49,"DeKuyper Razzmatazz Schnapps Liqueur, Red Wine, Mixed Berries, Soda Water",['red'],"['bbq', 'summer', 'summer', 'summer']","The taste of fresh raspberries burst from this flavor-packed version of the classic sangria. Perfect for serving at your next fiesta or with the spiciest of foods, this sangria recipe combines DeKuyper?? Razzmatazz??, red wine, fresh berries & seasonal fruit with a splash of carbonated water for a cool, fizzy twist on your favorite drink. Learn how to make sangria now!",NA,NA,NA,NA,NA,NA,NA,NA,nocinnamon,nomint,nolime
Spring Sangria,https://www.thecocktailproject.com/drink-recipes/spring-sangria,"White Wine, Dry, DeKuyper Peachtree Schnapps Liqueur, White Wine, Dry, DeKuyper Peachtree Schnapps Liqueur, Sugar, Peaches and Grapes, Lemon Wheel",Cordials,Fruity,3,43,"White Wine, Dry, DeKuyper Peachtree Schnapps Liqueur, Sugar, Peaches and Grapes, Lemon Wheel",['yellow'],"['bbq', 'brunch', 'spring']",,NA,NA,NA,NA,NA,NA,NA,NA,nocinnamon,nomint,nolime
Nectarita,https://www.thecocktailproject.com/drink-recipes/nectarita,"DeKuyper Peachtree Schnapps Liqueur, DeKuyper Triple Sec Liqueur, DeKuyper Peachtree Schnapps Liqueur, DeKuyper Triple Sec Liqueur, Sauza Blue Silver 100% Agave Tequila, Sour Mix",Cordials,Sour,3,23,"DeKuyper Peachtree Schnapps Liqueur, DeKuyper Triple Sec Liqueur, Sauza Blue Silver 100% Agave Tequila, Sour Mix",['yellow'],"['bbq', 'birthday', 'summer', 'summer', 'summer']",,NA,NA,NA,NA,NA,NA,NA,NA,nocinnamon,nomint,nolime
Blue Martini,https://www.thecocktailproject.com/drink-recipes/blue-martini,"Pinnacle Citrus Vodka, Pinnacle Citrus Vodka, Sour Mix",Cordials,Sour,3,36,"Pinnacle Citrus Vodka, Sour Mix",,"['ladies-night', 'summer', 'summer', 'tropical']","Boasting a distinctive blue hue and an extra sweet punch, this Blue Martini recipe is almost too pretty to drink. It combines Pucker?? Island Punch Schnapps with smooth Pinnacle?? Citrus Vodka and sour mix to create a sophisticated cocktail with island-inspired tastes. This tropical martini recipe is easy to pull off - making it perfect for girls' night in, relaxing by the pool or sipping after work.",NA,NA,NA,NA,NA,NA,NA,NA,nocinnamon,nomint,nolime
Sauza Razzmatazz Margarita,https://www.thecocktailproject.com/drink-recipes/sauza-razzmatazz-margarita,"Sauza Silver Tequila, DeKuyper Razzmatazz Schnapps Liqueur, Sauza Silver Tequila, DeKuyper Razzmatazz Schnapps Liqueur, Lime Juice, Simple Syrup, Salt",Cordials,Sour,3,64,"Sauza Silver Tequila, DeKuyper Razzmatazz Schnapps Liqueur, Lime Juice, Simple Syrup, Salt",['red'],"['bbq', 'summer', 'summer', 'summer']",,NA,NA,NA,citrus,NA,NA,NA,NA,nocinnamon,nomint,lime
Blushing Margarita,https://www.thecocktailproject.com/drink-recipes/blushing-margarita,"DeKuyper Triple Sec Liqueur, Sauza Blue Silver 100% Agave Tequila, DeKuyper Triple Sec Liqueur, Sauza Blue Silver 100% Agave Tequila, Lime Juice, Cranberry Juice",Cordials,Sour,3,48,"DeKuyper Triple Sec Liqueur, Sauza Blue Silver 100% Agave Tequila, Lime Juice, Cranberry Juice",['pink'],"['bbq', 'birthday', 'ladies-night', 'summer', 'summer', 'summer']",,NA,cranberry,NA,citrus,NA,NA,NA,NA,nocinnamon,nomint,lime
Cherry Margarita,https://www.thecocktailproject.com/drink-recipes/cherry-margarita,"DeKuyper Pucker Cherry Schnapps, Sauza Blue Silver 100% Agave Tequila, DeKuyper Pucker Cherry Schnapps, Sauza Blue Silver 100% Agave Tequila, Lime Juice",Cordials,Fruity,3,30,"DeKuyper Pucker Cherry Schnapps, Sauza Blue Silver 100% Agave Tequila, Lime Juice",['red'],"['ladies-night', 'summer', 'summer', 'summer']",,NA,NA,NA,citrus,NA,NA,NA,NA,nocinnamon,nomint,lime
Elderflower Margarita,https://www.thecocktailproject.com/drink-recipes/elderflower-margarita,"Sauza Blue Silver 100% Agave Tequila, JDK & Sons???????????????? Fleur Elderflower Liqueur, Sauza Blue Silver 100% Agave Tequila, JDK & Sons???????????????? Fleur Elderflower Liqueur, Lime Juice, Easy Ice Tips",Cordials,Sour,3,42,"Sauza Blue Silver 100% Agave Tequila, JDK & Sons???????????????????????? Fleur Elderflower Liqueur, Lime Juice, Easy Ice Tips",['clear'],"['bbq', 'ladies-night']",,NA,NA,NA,citrus,NA,NA,NA,NA,nocinnamon,nomint,lime
Coconut Snowball Martini,https://www.thecocktailproject.com/drink-recipes/coconut-snowball-martini,"Pinnacle Original Vodka, Cruzan Aged Light Rum, Pinnacle Original Vodka, Cruzan Aged Light Rum, DeKuyper Blue Curacao Liqueur, Cream of Coconut, Honey, Shredded Coconut",Rum,Sweet,3,66,"Pinnacle Original Vodka, Cruzan Aged Light Rum, DeKuyper Blue Curacao Liqueur, Cream of Coconut, Honey, Shredded Coconut",,"['ladies-night', 'holiday', 'tropical', 'winter']",,NA,NA,NA,NA,NA,NA,NA,NA,nocinnamon,nomint,nolime
Double Razzmatazz Grape Martini,https://www.thecocktailproject.com/drink-recipes/double-razzmatazz-grape-martini,"DeKuyper Pucker Grape Schnapps, DeKuyper Razzmatazz Schnapps Liqueur, DeKuyper Pucker Grape Schnapps, DeKuyper Razzmatazz Schnapps Liqueur, Pinnacle Raspberry Vodka, Lemon-Lime Soda",Cordials,Sweet,3,30,"DeKuyper Pucker Grape Schnapps, DeKuyper Razzmatazz Schnapps Liqueur, Pinnacle Raspberry Vodka, Lemon-Lime Soda",['red'],"['ladies-night', 'new-years', 'summer', 'summer', 'summer']",,NA,NA,NA,citrus,NA,NA,NA,NA,nocinnamon,nomint,lime
Elderflower Martini,https://www.thecocktailproject.com/drink-recipes/elderflower-martini,"EFFEN Original Vodka, JDK & Sons???????????????? Fleur Elderflower Liqueur, EFFEN Original Vodka, JDK & Sons???????????????? Fleur Elderflower Liqueur, Lime Juice",Cordials,Sour,3,43,"EFFEN Original Vodka, JDK & Sons???????????????????????? Fleur Elderflower Liqueur, Lime Juice",['clear'],"['birthday', 'ladies-night', 'summer', 'summer', 'summer', 'wedding']",,NA,NA,NA,citrus,NA,NA,NA,NA,nocinnamon,nomint,lime
Ginger Martini,https://www.thecocktailproject.com/drink-recipes/ginger-martini,"DeKuyper Mixologist Collection Ginger Liqueur, EFFEN Original Vodka, DeKuyper Mixologist Collection Ginger Liqueur, EFFEN Original Vodka, Fresh Ingredient Enhancements",Cordials,Sweet,3,24,"DeKuyper Mixologist Collection Ginger Liqueur, EFFEN Original Vodka, Fresh Ingredient Enhancements",['clear'],"['christmas', 'holiday', 'winter']",,NA,NA,NA,NA,NA,fresh,NA,NA,nocinnamon,nomint,nolime
Apple Colada,https://www.thecocktailproject.com/drink-recipes/apple-colada,"DeKuyper Tropical Coconut Liqueur, Apple Juice, DeKuyper Tropical Coconut Liqueur, Apple Juice, Lime Wedges",Cordials,Fruity,3,52,"DeKuyper Tropical Coconut Liqueur, Apple Juice, Lime Wedges",['yellow'],"['summer', 'summer', 'tropical']",,NA,NA,NA,citrus,NA,NA,NA,NA,nocinnamon,nomint,lime
Lazy Day Colada,https://www.thecocktailproject.com/drink-recipes/lazy-day-colada,"DeKuyper Pucker Sour Apple Schnapps, Cruzan Aged Light Rum, DeKuyper Pucker Sour Apple Schnapps, Cruzan Aged Light Rum, Pina Colada Mix",Cordials,Sweet,3,40,"DeKuyper Pucker Sour Apple Schnapps, Cruzan Aged Light Rum, Pina Colada Mix",['yellow'],"['bbq', 'summer', 'summer', 'tropical']",,NA,NA,NA,NA,NA,NA,NA,NA,nocinnamon,nomint,nolime
Fall Sangria,https://www.thecocktailproject.com/drink-recipes/fall-sangria,"DeKuyper Triple Sec, Apple Cider, DeKuyper Triple Sec, Apple Cider, Apples, Oranges, Lemons, Cinnamon Sticks, Soda Water",Cordials,Sweet,3,58,"DeKuyper Triple Sec, Apple Cider, Apples, Oranges, Lemons, Cinnamon Sticks, Soda Water",['brown'],"['bbq', 'birthday', 'fall']","Sangria isn??t just for summer anymore! Mix together crisp apple cider, aromatic cinnamon, DeKuyper?? Triple Sec, and white wine. Top it all off with soda water. The result? A light and delicious fall sangria cocktail you??ll want to share with friends.",NA,NA,NA,NA,NA,NA,NA,cinnamon,cinnamon,nomint,nolime
Banana Cinnamon Mojito,https://www.thecocktailproject.com/drink-recipes/banana-cinnamon-mojito,"Cruzan Banana Rum, Lime, Cruzan Banana Rum, Lime, Mint, Fresh, Soda Water, Mint, Fresh, Cinnamon Stick",Rum,Sweet,3,28,"Cruzan Banana Rum, Lime, Mint, Fresh, Soda Water, Mint, Fresh, Cinnamon Stick",['brown'],"['spring', 'summer']",,NA,NA,NA,citrus,NA,fresh,NA,cinnamon,cinnamon,mint,lime
Strawberry Lemonade Mojito,https://www.thecocktailproject.com/drink-recipes/strawberry-lemonade-mojito,"Cruzan Strawberry Rum, Lemon Wedges, Cruzan Strawberry Rum, Lemon Wedges, Fresh Mint Leaves, Sugar, Lemonade, Sparkling, Strawberries, Lemon Twist",Rum,Fruity,3,33,"Cruzan Strawberry Rum, Lemon Wedges, Fresh Mint Leaves, Sugar, Lemonade, Sparkling, Strawberries, Lemon Twist",['yellow'],"['bbq', 'brunch', 'spring', 'summer']","Bask in the taste of fresh summer berries with a new twist on a classic: The Strawberry Mojito. Cool mint and crisp lemon meet Cruzan?? Strawberry Rum to deliver the natural flavor of real strawberries to this refreshing drink. Whip up a few batches of strawberry lemonade mojitos in a flash and serve them at your next pool party, barbecue or summer gathering.",NA,NA,NA,NA,NA,fresh,NA,NA,nocinnamon,mint,nolime
Cruzan Peach Sangria,https://www.thecocktailproject.com/drink-recipes/cruzan-peach-sangria,"Cruzan Peach Rum, Lemon Sour, Cruzan Peach Rum, Lemon Sour, Skinnygirl Chardonnay, Lemon, Sliced, Lime, Sliced",Rum,Fruity,3,35,"Cruzan Peach Rum, Lemon Sour, Skinnygirl Chardonnay, Lemon, Sliced, Lime, Sliced",['clear'],"['bbq', 'spring', 'summer']","Tangy lemon, lime and fresh peach flavors come together in this light and cool version of the classic sangria. It features reduced-calorie Skinnygirl?? Chardonnay and the juicy, ripe peach taste of Cruzan?? Peach Rum, creating a Peach Sangria that's reminiscent of the summer season??s finest fruit harvest. Enjoy these rum sangria drinks while relaxing outdoors or serve them up at your next summer party.",NA,NA,NA,citrus,NA,NA,NA,NA,nocinnamon,nomint,lime
Peach Daiquiri,https://www.thecocktailproject.com/drink-recipes/peach-daiquiri,"Cruzan Peach Rum, Cruzan Aged Light Rum, Cruzan Peach Rum, Cruzan Aged Light Rum, Simple Syrup, Lime Wheel",Rum,Fruity,3,48,"Cruzan Peach Rum, Cruzan Aged Light Rum, Simple Syrup, Lime Wheel",['clear'],"['spring', 'summer']","What happens when you blend fine rum with the juicy taste of ripe peaches? You've got the makings of the perfect peach daiquiri. Fresh lime and simple syrup combine with the summery goodness of Cruzan?? Peach Rum and the full-bodied, smooth taste of Cruzan?? Aged Light Rum to create a warm-weather favorite that's perfect for cooling off poolside, hanging out with friends or serving at your next outdoor gathering.",NA,NA,NA,citrus,NA,NA,NA,NA,nocinnamon,nomint,lime
Island Breeze,https://www.thecocktailproject.com/drink-recipes/island-breeze,"Cruzan Aged Dark Rum, Cruzan Peach Rum, Cruzan Aged Dark Rum, Cruzan Peach Rum, Pineapple Juice, Cranberry Juice, Orange and Cherry Flag",Rum,Fruity,3,41,"Cruzan Aged Dark Rum, Cruzan Peach Rum, Pineapple Juice, Cranberry Juice, Orange and Cherry Flag",['orange'],"['summer', 'tropical']",,NA,cranberry,pineapple,NA,NA,NA,NA,NA,nocinnamon,nomint,nolime
Classic Rum Punch,https://www.thecocktailproject.com/drink-recipes/classic-rum-punch,"Cruzan Aged Light Rum, Cruzan 9 Spiced Rum, Cruzan Aged Light Rum, Cruzan 9 Spiced Rum, Orange Juice, Cranberry Juice, Pineapple Slice",Rum,Fruity,3,29,"Cruzan Aged Light Rum, Cruzan 9 Spiced Rum, Orange Juice, Cranberry Juice, Pineapple Slice",['orange'],"['bbq', 'summer', 'tropical']","Ideal for wedding showers and special lunches, there's nothing like a beautiful bowl of classic rum punch to add some zing to a gathering. Bursting with orange and cranberry flavors that combine perfectly with the rum's complex layers of taste, this rum punch is the perfect recipe for your next gathering.",orange,cranberry,NA,NA,NA,NA,NA,NA,nocinnamon,nomint,nolime
Bay Breeze,https://www.thecocktailproject.com/drink-recipes/bay-breeze,"Cruzan Aged Light Rum, Pineapple Juice, Cruzan Aged Light Rum, Pineapple Juice, Cranberry Juice, Strawberries, Using Fresh Citrus",Rum,Fruity,3,53,"Cruzan Aged Light Rum, Pineapple Juice, Cranberry Juice, Strawberries, Using Fresh Citrus",['pink'],"['bbq', 'summer', 'tropical']","There??s no need to be bay side to enjoy the breeze. This bay breeze recipe is sweet, tart and very smooth. Cruzan?? Aged Light Rum has a warm, round flavor that blends well with the tropical taste of this simple drink. Garnish with pineapple or strawberry for a cocktail that is perfect for a night in with friends or a backyard BBQ.",NA,cranberry,pineapple,NA,NA,fresh,NA,NA,nocinnamon,nomint,nolime
Banana Nana,https://www.thecocktailproject.com/drink-recipes/banana-nana,"Cruzan Banana Rum, Cruzan Aged Dark Rum, Cruzan Banana Rum, Cruzan Aged Dark Rum, Orange Juice",Rum,Fruity,3,36,"Cruzan Banana Rum, Cruzan Aged Dark Rum, Orange Juice",['orange'],"['summer', 'tropical']",,orange,NA,NA,NA,NA,NA,NA,NA,nocinnamon,nomint,nolime
Voodoo Hurricane,https://www.thecocktailproject.com/drink-recipes/voodoo-hurricane,"Cruzan 9 Spiced Rum, Cruzan 151 Rum, Cruzan 9 Spiced Rum, Cruzan 151 Rum, Cruzan Vanilla Rum, Orange Juice, Pineapple Juice, Grenadine, Fruit Wedge",Rum,Fruity,2,54,"Cruzan 9 Spiced Rum, Cruzan 151 Rum, Cruzan Vanilla Rum, Orange Juice, Pineapple Juice, Grenadine, Fruit Wedge",['orange'],"['ladies-night', 'summer', 'tropical']",,orange,NA,pineapple,NA,NA,NA,NA,NA,nocinnamon,nomint,nolime
Rum Breeze,https://www.thecocktailproject.com/drink-recipes/rum-breeze,"Cruzan Black Cherry Rum, Cruzan Aged Light Rum, Cruzan Black Cherry Rum, Cruzan Aged Light Rum, Pineapple Juice, Ginger Ale, Lime Twist",Rum,Fruity,3,53,"Cruzan Black Cherry Rum, Cruzan Aged Light Rum, Pineapple Juice, Ginger Ale, Lime Twist",['yellow'],"['birthday', 'summer', 'tropical']",,NA,NA,pineapple,citrus,NA,NA,NA,NA,nocinnamon,nomint,lime
Endless Summer Punch,https://www.thecocktailproject.com/drink-recipes/endless-summer-punch,"Cruzan Pineapple Rum, Cruzan Aged Dark Rum, Cruzan Pineapple Rum, Cruzan Aged Dark Rum, Cruzan Coconut Rum, Orange Juice, Lemonade, Pineapple Wedge",Rum,Sweet,3,44,"Cruzan Pineapple Rum, Cruzan Aged Dark Rum, Cruzan Coconut Rum, Orange Juice, Lemonade, Pineapple Wedge",['yellow'],"['bbq', 'summer']","Warm weather may come and go, but this summer cocktail is tasty all year round. Tropical flavors of pineapple, coconut and robust rum are topped off with tangy orange juice and lemonade for a sweet, fruity drink that will bring you right back to the beach.",orange,NA,NA,NA,NA,NA,NA,NA,nocinnamon,nomint,nolime
Cruzan Confusion,https://www.thecocktailproject.com/drink-recipes/cruzan-confusion,"Cruzan Coconut Rum, Cruzan Mango Rum, Cruzan Coconut Rum, Cruzan Mango Rum, Pineapple Juice, Mango, Easy Ice Tips",Rum,Fruity,3,77,"Cruzan Coconut Rum, Cruzan Mango Rum, Pineapple Juice, Mango, Easy Ice Tips",['clear'],"['bbq', 'summer', 'tropical']",There??s nothing confusing about this island drink except who gets to take the first sip! Rich coconut rum pairs perfectly with the tropical flavors of mango and pineapple. Whip it up in a splash and enjoy at a picnic or poolside.,NA,NA,pineapple,NA,NA,NA,NA,NA,nocinnamon,nomint,nolime
Pina Colada Martini,https://www.thecocktailproject.com/drink-recipes/pina-colada-martini,"Cruzan Coconut Rum, Cruzan Pineapple Rum, Cruzan Coconut Rum, Cruzan Pineapple Rum, Pineapple Juice, Pineapple Wedge",Rum,Sweet,3,43,"Cruzan Coconut Rum, Cruzan Pineapple Rum, Pineapple Juice, Pineapple Wedge",['yellow'],"['spring', 'summer', 'tropical']",Enjoy a double blast of tropical flavors with this Pina Colada Martini recipe. Fresh pineapple and coconut flavors combine to bring a taste of the island to any gathering - from outdoor parties to hanging out with friends.,NA,NA,pineapple,NA,NA,NA,NA,NA,nocinnamon,nomint,nolime
Strawberry Rosemary Punch,https://www.thecocktailproject.com/drink-recipes/strawberry-rosemary-punch,"Cruzan Strawberry Rum, Lime Juice, Cruzan Strawberry Rum, Lime Juice, Ginger Ale, Rosemary Sprigs",Rum,Sweet,4,28,"Cruzan Strawberry Rum, Lime Juice, Ginger Ale, Rosemary Sprigs",['clear'],"['ladies-night', 'summer']",,NA,NA,NA,citrus,NA,NA,NA,NA,nocinnamon,nomint,lime
